{
  "schemaVersion": "tpkit.review-round/v1alpha1",
  "kind": "ReviewRound",
  "metadata": {
    "id": "example-round-3-packet",
    "roundId": "example-round-3",
    "createdAt": "2026-10-01T09:00:00Z"
  },
  "handling": {
    "visibility": "public",
    "redaction": "none"
  },
  "provenance": {
    "repository": "example-kit",
    "baseRevision": "1111111111111111111111111111111111111111",
    "targetRevision": "2222222222222222222222222222222222222222",
    "artifactPath": "examples/review-round/schema-cases/valid/valid-no-findings-when-answer-key-allows/review-round.json"
  },
  "roles": {
    "reviewer": {
      "role": "aide"
    },
    "verifier": {
      "role": "lead"
    },
    "decisionMaker": {
      "role": "operator"
    }
  },
  "scope": {
    "paths": [
      "docs/checks.md",
      "scripts/check.sh"
    ],
    "intent": "Review a synthetic change whose answer key expects no findings."
  },
  "requiredChecks": [
    {
      "id": "check-selftest",
      "command": "./scripts/check.sh --selftest",
      "description": "The script's built-in self-test."
    }
  ],
  "restrictions": {
    "network": "prohibited",
    "secrets": "prohibited",
    "remoteAccess": "prohibited"
  },
  "fixture": {
    "answerKey": "examples/review-round/schema-cases/valid/valid-no-findings-when-answer-key-allows/answer-key.json"
  }
}
